date	experiment	variable	baseline	result	verdict	decode_toks	notes
2026-03-22	v3-baseline	lazy-conversion-serial	0.03	serial f16→f32 per layer, clones per token	baseline	0.03	initial state
2026-03-22	v3-zero-copy	no-clone-borrows	0.03	eliminated .clone() epidemic	keep	0.03	100GB memcpy saved
2026-03-22	v3-pipelined	channel-pipeline	-	pipeline conversion+compute, alloc thrashing	reverted	-	DEAD END: alloc thrashing worse than serial
2026-03-22	v3-single-buf	buffer-reuse	0.03	single buffer reuse, mmap page faults	keep	0.03	zero allocs after warmup
2026-03-22	v3-pread-experts	expert-pager-pread	0.03	pread experts (21x faster), conv now bottleneck	keep	0.2	replaced 348GB mmap thrashing
2026-03-22	v3-rayon-conv	par-chunk-conversion	0.2	7.3ms/layer conv (8.5x), 28ms/layer compute	keep	0.5	saturate memory bandwidth across cores
2026-03-22	v3-par-pread	parallel-pread+cached-metal	0.5	12.8ms/layer compute, 7.3ms conv, need pipeline	keep	0.7	NVMe QD>1 for throughput
2026-03-22	v3-rayon-pread	rayon-direct-staging	0.7	22.4ms/layer, rayon pread, no alloc overhead	keep	0.7	current architecture baseline
2026-03-22	v3-f16-sgemv	chunked-f16-sgemv	0.7	86ms/layer, per-chunk overhead dominates	reverted	0.2	DEAD END: 4x slower than convert+sgemv_f32
2026-03-22	v3-final	convert+sgemv+pread+rayon	0.03	22ms/layer avg, 1000x from baseline	current-best	0.7	Phase 1 final state
2026-03-22	v3-manual-gemv	manual-loops-vs-blas-perhead	0.7	manual 3x slower than AMX BLAS (520μs vs 170μs)	REVERTED	0.67	AMX dispatch overhead only ~1.3μs/call, AMX compute >> NEON fmla for [128,512] matrices
2026-03-22	v3-pipeline-decode	thread-scope-double-buffer	0.7	overlap convert(N+1) with compute(N), 21.5→20.6ms/layer	keep	0.8	14% improvement, 1.4ms/layer saved, thread::scope 21μs overhead
2026-03-22	v3-sgemm-attention	batch-scores+values-sgemm	0.8	replace scalar f64 attn loops with sgemm_nt+sgemm, median 0.81	NO EFFECT	0.81	correct but target too small: scalar loops ~0.1ms/layer at seq_len=5, total savings <6ms/token (<0.5%). Will matter at seq_len>100. Also eliminates 128 per-head allocs/layer.
2026-03-22	v3-f16-direct-path	sgemv-f16-bypass-convert	0.8	replace pipeline f32 with direct sgemv_f16 + vectorized FCVTL + L2-adaptive chunks + thread-local bufs	REVERTED	0.54	DEAD END: single-threaded conversion in sgemv_f16 (~80 GB/s 1 P-core) loses to rayon multi-core f32 conversion (~300 GB/s) + pipeline overlap. Even with vectorized FCVTL, halving memory traffic cannot compensate for losing 12-core parallelism.
2026-03-22	v3-elim-norm-allocs	rmsnorm-into+final-norm-borrow	0.8	rmsnorm_into() reuses buffer, removed 4× final_norm.to_vec(), eliminated 126 allocs/tok (~3.4 MB)	NO EFFECT	0.79	correct refactor, alloc savings ~50μs/tok invisible at 1300ms/tok. Reduces allocator pressure + cache pollution. median 0.79 across 3 runs (22.0ms/layer). Also pre-existing test_v3_validation L2 failure (layers_f32 empty in lazy mode).
2026-03-22	v3-overlap-pread-ffn	thread-scope-pread-parallel-shared-ffn	0.8	overlap expert pread with shared FFN via thread::scope, 22.0→16.2ms/layer	IMPROVED	1.06	34% improvement (0.79→1.06 tok/s). Pread (SSD I/O) and shared FFN (memory BW) don't compete for same resource. Saved 5.8ms/layer × 58 MoE layers = 336ms/token. median 1.06 across 3 runs (16.2, 16.3, 17.9 ms/layer).
2026-03-22	v3-deferred-convert	defer-convert-after-mla	1.06	split run_layer_compute into run_mla_only+run_ffn_only, defer convert(N+1) to overlap with FFN only (not MLA), 16.2→15.2ms/layer	IMPROVED	1.13	6.6% improvement (1.06→1.13 tok/s). MLA sgemv is memory-bandwidth-bound; concurrent conversion thread stole ~15% BW. Deferring to FFN phase (Metal GPU + SSD pread, no BW contention) recovers ~1.0ms/layer × 61 = 61ms/token. median 1.13 across 3 runs (15.6, 15.2, 15.1 ms/layer).
2026-03-22	v3-overlap-metal-convert	split-ffn-metal-vs-convert	1.13	split moe_ffn into prepare(shared+pread) + dispatch(Metal), overlap convert(N+1) with Metal dispatch instead of full FFN	NO EFFECT	1.11	M4 Max unified memory handles concurrent AMX+rayon without measurable BW contention. Both pipelines take ~7ms for FFN: original max(3ms convert, 7ms FFN)=7ms vs split 4ms shared+max(3ms convert, 3ms Metal)=7ms. median 1.11 across 3 runs (17.7, 15.3, 15.5 ms/layer first token).
2026-03-22	v3-rayon-perhead-sgemv	rayon-parallel-wuk-wuv-perhead	1.13	rayon par_chunks_mut for 128 per-head W_UK sgemv_f32_trans + W_UV sgemv_f32 in mla_forward_decode	NO EFFECT	1.14	per-head sgemv on [128,512] matrices takes ~1μs each (not 4.5μs estimated) due to L2 cache residency + hardware prefetch. Total W_UK+W_UV is ~260μs/layer, parallelizing saves ~6ms/token (<1%). median 1.14 across 3 runs (15.6, 15.1, 14.8 ms/layer). Within noise of baseline 1.13.
2026-03-22	v3-overlap-convert0-lastlayer	overlap-convert0-with-last-ffn	1.13	overlap convert(layer 0) with last layer FFN via thread::scope, pre-warm buf_a for next token	NO EFFECT	1.1	last layer (60) is dense FFN (CPU sgemv), not MoE (Metal+pread). Convert(0) rayon threads compete for same CPU memory bandwidth as dense FFN. Net savings ~2.5ms convert(0) minus ~3ms BW contention = no improvement. median 1.1 across 3 runs (16.4, 16.1, 16.2 ms/layer first token). REVERTED.
2026-03-22	v3-parallel-gate-up	thread-scope-parallel-gate-up-sgemv	1.13	parallel gate+up sgemv in shared_expert_ffn and dense_ffn via thread::scope, separate P-cores with independent AMX	NO EFFECT	1.14	thread::scope(gate||up) in SwiGLU FFN. Hypothesis: save 0.39ms×58 MoE + 3.5ms×3 dense = ~33ms. Reality: median 1.14 across 3 runs (15.0, 15.1, 15.0 ms/layer). Within noise of baseline 1.13. Likely cause: Apple BLAS sgemv already achieves ~150 GB/s per AMX core (not 80 GB/s), so gate+up serial time is ~0.78ms not ~1.46ms for shared expert. Savings of ~0.39ms minus 21μs scope overhead per layer = ~22ms total = 2.5%. Below noise threshold.
2026-03-22	v3-parallel-oproj	rayon-par-chunks-oproj-rows	1.13	rayon par_chunks_mut to split O projection [7168,16384] sgemv across 4 threads, each computing 1792 rows	REVERTED	1.07	5.3% REGRESSION. Hypothesis: split 470MB sgemv across 4 cores at ~450 GB/s → save 2ms/layer. Reality: median 1.07 across 3 runs (16.1, 15.8, 16.2 ms/layer). Likely cause: Apple Accelerate cblas_sgemv already internally multi-threads for large matrices. Explicit row-partitioning defeats BLAS internal parallelization — 4 small sgemv calls less efficient than 1 large one that BLAS optimizes internally. This closes the "explicit sgemv parallelization" family of optimizations.
2026-03-22	v3-cached-layer0	cache-layer0-skip-convert	1.13	third buf_layer0 caches layer 0 f32 weights across tokens, peel layer 0 out of decode loop to skip serial convert_layer_into(0)	NO EFFECT	1.15	median 1.15 across 3 runs (14.8, 15.2, 15.4 ms/layer). Hypothesis: save ~5ms serial convert(0) per token. Reality: 5ms / 940ms per token = 0.5% improvement, well below noise threshold. Confirms the exhaustion note: all remaining CPU-side optimizations are <3% individually.
2026-03-22	v3-f16-oproj-mmap	sgemv-f16-par-oproj-from-mmap	1.13	skip o_proj f32 conversion, read f16 directly from mmap via sgemv_f16_par (rayon chunked convert+sgemv), halve DRAM traffic 470→235 MB	REVERTED	0.86	24% REGRESSION (1.13→0.86 tok/s, 15.2→19.6 ms/layer). Hypothesis: 235 MB f16 < 470 MB f32 = less DRAM traffic. Reality: pre-converted f32 buffer is warm in RAM from background thread; mmap f16 pages are cold (not recently accessed). Chunked convert+sgemv on mmap pages incurs page faults + loses BLAS internal parallelism. Confirms: f16-from-mmap on critical path is always slower than pre-warmed f32 from pipeline overlap.
